created_at,full_text,translate,clean_tweet,lower,stopword,tokenize,stemmed,clean
Mon Apr 15 14:28:32 +0000 2024,@H1m4_W4r1 @AyamSegar3 @_sekarkinanthi_ @jokowi @gibran_tweet @Gerindra @prabowo @fadlizon @psi_id @kaesangp @golkar_id @golkarpedia @Alitt4mb3ng @AntonKu08408962 @Uki23 @adi_sareang @PartBurungGalak @mikuroQ @T0M5helby @Aryprasetyo85 @hilalmultibiz @SantorinisSun @adearmando61 @budimandjatmiko Kamu pikir org2 PDIP pada idiooot... https://t.co/PJ7FXYZgvl,@H1m4_w4r1 @ayamsegar3 @_sekarkinanthi_ @jokowi @gibran_tweet @gerindra @prabowo @fadlizon @psi_id @kaesangp @golkar_id @golkarpedia @alitt4mb3ng @antonku08408962 5helby @aryprasetyo85 @hilalmultibiz @santorinissun @adearmando61 @budimandjatmiko you thinkorg2 pdip on idiooot ... https://t.co/pj7fxyzgvl,helbyyou thinkorg pdip on idiooot https t co pjfxyzgvl,helbyyou thinkorg pdip on idiooot https t co pjfxyzgvl,helbyyou thinkorg pdip idiooot https co pjfxyzgvl,"['helbyyou', 'thinkorg', 'pdip', 'idiooot', 'https', 'co', 'pjfxyzgvl']","['helbyy', 'thinkorg', 'pdip', 'idiooot', 'http', 'co', 'pjfxyzgvl']",helbyy thinkorg pdip idiooot http co pjfxyzgvl
Mon Apr 15 14:27:33 +0000 2024,@gobanovski93026 @Vifebs @Uki23 @psi_id Silahkan Googling .. masi ada lagi kasus seksual lain yang ga saya post .. Serius Jawab,@gobanovski93026 @vifebs @uki23 @psi_id please googling .. still there are more sexual cases that I don't post .. seriously answer,please googling still there are more sexual cases that I don t post seriously answer,please googling still there are more sexual cases that i don t post seriously answer,please googling still sexual cases post seriously answer,"['please', 'googling', 'still', 'sexual', 'cases', 'post', 'seriously', 'answer']","['pleas', 'googl', 'still', 'sexual', 'case', 'post', 'serious', 'answer']",pleas googl still sexual case post serious answer
Mon Apr 15 14:24:03 +0000 2024,@topiranath Limpa limpa limpa,@topiranath spleen spleen spleen,spleen spleen spleen,spleen spleen spleen,spleen spleen spleen,"['spleen', 'spleen', 'spleen']","['spleen', 'spleen', 'spleen']",spleen spleen spleen
Mon Apr 15 14:22:49 +0000 2024,@H1m4_W4r1 @AyamSegar3 @_sekarkinanthi_ @jokowi @gibran_tweet @Gerindra @prabowo @fadlizon @psi_id @kaesangp @golkar_id @golkarpedia @Alitt4mb3ng @AntonKu08408962 @Uki23 @adi_sareang @PartBurungGalak @mikuroQ @T0M5helby @Aryprasetyo85 @hilalmultibiz @SantorinisSun @adearmando61 @budimandjatmiko Kamu apain akun sy kok g ada notif kamu.... Opa Ulik melamar Gibran hari ke 5....... DUNGU Bukankah ini smua sdh di rencanakan dgn baik sm Mukidi.... https://t.co/A8BQ5RiFPg https://t.co/hCC4GhBmi8,"@H1m4_w4r1 @ayamsegar3 @_sekarkinanthi_ @jokowi @gibran_tweet @gerindra @prabowo @fadlizon @psi_id @kaesangp @golkar_id @golkarpedia @alitt4mb3ng @antonku08408962 5helby @aryprasetyo85 @hilalmultibiz @santorinissun @adearmando61 @budimandjatmiko what are youI don't have your account, there is your notification .... Opa Ulik applied for Gibran on the 5th day ...: //t.co/HCC4GHBMI8",helbywhat are youI don t have your account there is your notification Opa Ulik applied for Gibran on the th day t co HCCGHBMI,helbywhat are youi don t have your account there is your notification opa ulik applied for gibran on the th day t co hccghbmi,helbywhat youi account notification opa ulik applied gibran day co hccghbmi,"['helbywhat', 'youi', 'account', 'notification', 'opa', 'ulik', 'applied', 'gibran', 'day', 'co', 'hccghbmi']","['helbywhat', 'youi', 'account', 'notif', 'opa', 'ulik', 'appli', 'gibran', 'day', 'co', 'hccghbmi']",helbywhat youi account notif opa ulik appli gibran day co hccghbmi
Mon Apr 15 14:21:50 +0000 2024,@Hasmukhpatelips Sir me civil engineering karelu che 2020 thi civil engineering thayari karu chu pan Haji sudhi selection thayu ny Atale have me police and PSI ni taiyari saru karvi che,@Hasmukhpatelips Sir Me Civil Engineering Karelu Che 2020 Thi Civil Engineering Thayari Karu Chu Pan Hajj Sudhi Selection Thayu Ny Atale Have Me Police and Psi Ni Taiyari Saru Karvi Che Che,Sir Me Civil Engineering Karelu Che  Thi Civil Engineering Thayari Karu Chu Pan Hajj Sudhi Selection Thayu Ny Atale Have Me Police and Psi Ni Taiyari Saru Karvi Che Che,sir me civil engineering karelu che  thi civil engineering thayari karu chu pan hajj sudhi selection thayu ny atale have me police and psi ni taiyari saru karvi che che,sir civil engineering karelu che thi civil engineering thayari karu chu pan hajj sudhi selection thayu ny atale police psi ni taiyari saru karvi che che,"['sir', 'civil', 'engineering', 'karelu', 'che', 'thi', 'civil', 'engineering', 'thayari', 'karu', 'chu', 'pan', 'hajj', 'sudhi', 'selection', 'thayu', 'ny', 'atale', 'police', 'psi', 'ni', 'taiyari', 'saru', 'karvi', 'che', 'che']","['sir', 'civil', 'engin', 'karelu', 'che', 'thi', 'civil', 'engin', 'thayari', 'karu', 'chu', 'pan', 'hajj', 'sudhi', 'select', 'thayu', 'ny', 'atal', 'polic', 'psi', 'ni', 'taiyari', 'saru', 'karvi', 'che', 'che']",sir civil engin karelu che thi civil engin thayari karu chu pan hajj sudhi select thayu ny atal polic psi ni taiyari saru karvi che che
Mon Apr 15 14:16:46 +0000 2024,@AyamSegar3 @H1m4_W4r1 @Dargomb33306384 @jokowi @gibran_tweet @Gerindra @prabowo @fadlizon @psi_id @kaesangp @golkar_id @golkarpedia @Alitt4mb3ng @AntonKu08408962 @Uki23 @adi_sareang @PartBurungGalak @mikuroQ @T0M5helby @Aryprasetyo85 @hilalmultibiz @SantorinisSun @adearmando61 @budimandjatmiko @H1m4_W4r1 &amp; grombolannya bukan goblog tp gak punya .,@Ayamsegar3 @h1m4_w4r1 @dargomb33306384 @jokowi @gibran_tweet @gerindra @prabowo @fadlizon 0m5helby @aryprasetyo85 @hilalmultibiz @santorinissun @adearmando61 @budimandjatmiko @h1m4_w4r1& amp;The grombola is not a goblog but doesn't have it.,mhelby wr amp The grombola is not a goblog but doesn t have it,mhelby wr amp the grombola is not a goblog but doesn t have it,mhelby wr amp grombola goblog,"['mhelby', 'wr', 'amp', 'grombola', 'goblog']","['mhelbi', 'wr', 'amp', 'grombola', 'goblog']",mhelbi wr amp grombola goblog
Mon Apr 15 14:16:22 +0000 2024,@StefanAntonio__ @Vifebs @Uki23 @psi_id Serius nanya separah itu kah ???,@Stefanantonio__ @vifebs @uki23 @psi_id seriously asking that bad ???,seriously asking that bad,seriously asking that bad,seriously asking bad,"['seriously', 'asking', 'bad']","['serious', 'ask', 'bad']",serious ask bad
Mon Apr 15 14:15:48 +0000 2024,@qtnx_ @yacineMTB bangarang,@qtnx_ @yacinemtb bangarang,bangarang,bangarang,bangarang,['bangarang'],['bangarang'],bangarang
Mon Apr 22 23:56:59 +0000 2024,@Uki23 Btw pencabulan d surabaya ama kades PSI ad komentar apa?,@Uki23 btw molestation in Surabaya and what comments do you have comments?,btw molestation in Surabaya and what comments do you have comments,btw molestation in surabaya and what comments do you have comments,btw molestation surabaya comments comments,"['btw', 'molestation', 'surabaya', 'comments', 'comments']","['btw', 'molest', 'surabaya', 'comment', 'comment']",btw molest surabaya comment comment
Mon Apr 22 23:53:15 +0000 2024,mau nanyaa grab gojek adakah jasa buat beli barang di kkvi? mau kekkvi buat beli paperbag tpi gaada yg antar YaAllah mau pke grab bolakbalik ke mall terlalu mahal,Want to ask Grab Gojek is a service for buying goods at KKVI?want to kekvi to buy a paperbag but there is no one who is delivered yaallah want to grab grab back to the mall is too expensive,Want to ask Grab Gojek is a service for buying goods at KKVI want to kekvi to buy a paperbag but there is no one who is delivered yaallah want to grab grab back to the mall is too expensive,want to ask grab gojek is a service for buying goods at kkvi want to kekvi to buy a paperbag but there is no one who is delivered yaallah want to grab grab back to the mall is too expensive,want ask grab gojek service buying goods kkvi want kekvi buy paperbag one delivered yaallah want grab grab back mall expensive,"['want', 'ask', 'grab', 'gojek', 'service', 'buying', 'goods', 'kkvi', 'want', 'kekvi', 'buy', 'paperbag', 'one', 'delivered', 'yaallah', 'want', 'grab', 'grab', 'back', 'mall', 'expensive']","['want', 'ask', 'grab', 'gojek', 'servic', 'buy', 'good', 'kkvi', 'want', 'kekvi', 'buy', 'paperbag', 'one', 'deliv', 'yaallah', 'want', 'grab', 'grab', 'back', 'mall', 'expens']",want ask grab gojek servic buy good kkvi want kekvi buy paperbag one deliv yaallah want grab grab back mall expens
Mon Apr 22 23:40:59 +0000 2024,@kyutiiiiiiii cdm yaa ka,@kyutiiiiiiiii cdm yaa ka,cdm yaa ka,cdm yaa ka,cdm yaa ka,"['cdm', 'yaa', 'ka']","['cdm', 'yaa', 'ka']",cdm yaa ka
Mon Apr 22 23:40:48 +0000 2024,@bearthss belajar ppu berkedok main family 100 heheheh,@bearthss Learning PPU under the guise of playing Family 100 heheheh,Learning PPU under the guise of playing Family  heheheh,learning ppu under the guise of playing family  heheheh,learning ppu guise playing family heheheh,"['learning', 'ppu', 'guise', 'playing', 'family', 'heheheh']","['learn', 'ppu', 'guis', 'play', 'famili', 'heheheh']",learn ppu guis play famili heheheh
Mon Apr 22 23:32:29 +0000 2024,wow sebegitu jahatnya lo sama ang 24? @ panit snbt,wow so bad you are the same as 24?@ SNBT Panit,wow so bad you are the same as  SNBT Panit,wow so bad you are the same as  snbt panit,wow bad snbt panit,"['wow', 'bad', 'snbt', 'panit']","['wow', 'bad', 'snbt', 'panit']",wow bad snbt panit
Mon Apr 22 23:29:40 +0000 2024,@DedynurPalakka Sialnya hanya TIDAK BERPENGARUH MEMBUAT PSI Lolos SENAYAN..!!! Sanjung dulu sepuasmu sebelum jadi Bahan Olokan ssban hari..!!! Masa Pengolokan itu akan tiba dalam waktu tidak lama lagi..!!! BTW apa sih prestasi Jokowi?? Pembiaran Korupsi?? Hutang 20.000 T? INPOR atau ekspor?,"@Dedynurpalakka unfortunately it just has no effect to make PSI pass Senayan .. !!!Sungan first to your heart's content before becoming a joke of ssban day .. !!!The manufacturing period will arrive in a short time .. !!!Btw what is Jokowi's achievement ??Corruption omission ??Debt 20,000 T?Inport or export?",unfortunately it just has no effect to make PSI pass Senayan Sungan first to your heart s content before becoming a joke of ssban day The manufacturing period will arrive in a short time Btw what is Jokowi s achievement Corruption omission Debt   T Inport or export,unfortunately it just has no effect to make psi pass senayan sungan first to your heart s content before becoming a joke of ssban day the manufacturing period will arrive in a short time btw what is jokowi s achievement corruption omission debt   t inport or export,unfortunately effect make psi pass senayan sungan first heart content becoming joke ssban day manufacturing period arrive short time btw jokowi achievement corruption omission debt inport export,"['unfortunately', 'effect', 'make', 'psi', 'pass', 'senayan', 'sungan', 'first', 'heart', 'content', 'becoming', 'joke', 'ssban', 'day', 'manufacturing', 'period', 'arrive', 'short', 'time', 'btw', 'jokowi', 'achievement', 'corruption', 'omission', 'debt', 'inport', 'export']","['unfortun', 'effect', 'make', 'psi', 'pass', 'senayan', 'sungan', 'first', 'heart', 'content', 'becom', 'joke', 'ssban', 'day', 'manufactur', 'period', 'arriv', 'short', 'time', 'btw', 'jokowi', 'achiev', 'corrupt', 'omiss', 'debt', 'inport', 'export']",unfortun effect make psi pass senayan sungan first heart content becom joke ssban day manufactur period arriv short time btw jokowi achiev corrupt omiss debt inport export
Mon Apr 22 23:26:27 +0000 2024,@shagnotshark @convomfs daripada ngereog,@shagnotshark @convomfs rather than ngereog,rather than ngereog,rather than ngereog,rather ngereog,"['rather', 'ngereog']","['rather', 'ngereog']",rather ngereog
Mon Apr 22 23:26:16 +0000 2024,@shagnotshark @convomf EMGNYA KM UDAH NIKAH?!?,@shagnotshark @convomf are you married?!?,are you married,are you married,married,['married'],['marri'],marri
Mon Apr 22 23:24:39 +0000 2024,Ketua PSI Sulsel PeDe Maju Pilwalkot https://t.co/HyQm7JDtNz,Chairperson of PSI Sulsel Pede Forward Pilwalkot https://t.co/hyqm7jdtnz,Chairperson of PSI Sulsel Pede Forward Pilwalkot https t co hyqmjdtnz,chairperson of psi sulsel pede forward pilwalkot https t co hyqmjdtnz,chairperson psi sulsel pede forward pilwalkot https co hyqmjdtnz,"['chairperson', 'psi', 'sulsel', 'pede', 'forward', 'pilwalkot', 'https', 'co', 'hyqmjdtnz']","['chairperson', 'psi', 'sulsel', 'pede', 'forward', 'pilwalkot', 'http', 'co', 'hyqmjdtnz']",chairperson psi sulsel pede forward pilwalkot http co hyqmjdtnz
Mon Apr 22 23:23:43 +0000 2024,@msaid_didu Cuma cengkeramannya di Legislatif/DPR masih kurang mantap karena PSI melempem. Makanya isu rujuk dengan PDIP atau Jokowi naik jadi ketum golkar masih berhembus kencang. Semoga PDIP berani jadi oposisi,@msaid_didu just a grip in the legislature/DPR is still not great because PSI is sluggish.That's why the issue of referring with PDIP or Jokowi rises so the Golkar Chairman is still blowing hard.I hope PDIP will be the opposition,just a grip in the legislature DPis still not great because PSI is sluggish That s why the issue of referring with PDIP or Jokowi rises so the Golkar Chairman is still blowing hard I hope PDIP will be the opposition,just a grip in the legislature dpis still not great because psi is sluggish that s why the issue of referring with pdip or jokowi rises so the golkar chairman is still blowing hard i hope pdip will be the opposition,grip legislature dpis still great psi sluggish issue referring pdip jokowi rises golkar chairman still blowing hard hope pdip opposition,"['grip', 'legislature', 'dpis', 'still', 'great', 'psi', 'sluggish', 'issue', 'referring', 'pdip', 'jokowi', 'rises', 'golkar', 'chairman', 'still', 'blowing', 'hard', 'hope', 'pdip', 'opposition']","['grip', 'legislatur', 'dpi', 'still', 'great', 'psi', 'sluggish', 'issu', 'refer', 'pdip', 'jokowi', 'rise', 'golkar', 'chairman', 'still', 'blow', 'hard', 'hope', 'pdip', 'opposit']",grip legislatur dpi still great psi sluggish issu refer pdip jokowi rise golkar chairman still blow hard hope pdip opposit
Mon Apr 22 23:18:30 +0000 2024,@RPrima789 @_sekarkinanthi_ @H1m4_W4r1 @165Hati @kenhans03 @seruanhl @DavidWijaya82 @psi_id @RizkiR4madani @Uki23 @YRadianto @DS_yantie @Alitt4mb3ng @mikuroQ @PartBurungGalak @msobri99 @SantorinisSun @Dargomb33306384 @Pemburu_Celeng @Lembayung071 @grace_nat @Jayabay19479190 @Fahrihamzah @fadlizon @Bambangmulyonoo @Bara_Rc @BiLLRaY2019 @branjangankawat @DedynurPalakka @dewiirawan13 @Djeng_Hiz @Edibaelah1990 @Manse_Mangat @RickyKardjono @OmpungGuru @RaniKancana @Jkt_Networks @RadjaRasta_ @pray_thekid @aariejazz @EviDrajat @Deaniss4 @mimih6mei @winantisri11 @KoesdionoN @Hiko00398441 Mantap mas https://t.co/4QxFWyKDyf,@Rprima789 @_sekarkinanthi_ @h1m4_w4r1 @165hati @kenhans03 @seruanl @davidwijaya82 @psi_id @rizkir4madani @uki23 @yradianto @ds_yantie @alitt4mb3ng @mikuroq ​​384 @pemburu_celeng @lembayung071 @grace_nat @jayabay19479190 @fahrihamzah @fadlizon @bambangmulyonooo@Bara_rc @billray2019 @brananjangankawat @dedynurpalakka @dwiirawan13 @djeng_hiz @edibalah1990 Isri11 @koesdionon @hiko00398441 Mantap Mas https: // t.Co/4QXFWYKDYF, Mas https t Co QXFWYKDYF, mas https t co qxfwykdyf,mas https co qxfwykdyf,"['mas', 'https', 'co', 'qxfwykdyf']","['ma', 'http', 'co', 'qxfwykdyf']",ma http co qxfwykdyf
Mon Apr 22 23:15:57 +0000 2024,@Uki23 Sayang PSI nyungseb,@Uki23 dear psi nyungseb,dear psi nyungseb,dear psi nyungseb,dear psi nyungseb,"['dear', 'psi', 'nyungseb']","['dear', 'psi', 'nyungseb']",dear psi nyungseb
Mon Apr 22 23:08:27 +0000 2024,@arieckive fren kata aku mah itu sakit ,@arieckive Fren said I was sick,Fren said I was sick,fren said i was sick,fren said sick,"['fren', 'said', 'sick']","['fren', 'said', 'sick']",fren said sick
Mon Apr 22 22:58:55 +0000 2024,@psi_id Masih punya MALU emang orang dari partai Ini ?,@psi_id still have shame people from this party?,still have shame people from this party,still have shame people from this party,still shame people party,"['still', 'shame', 'people', 'party']","['still', 'shame', 'peopl', 'parti']",still shame peopl parti
Mon Apr 22 22:49:17 +0000 2024,@psi_id BLUNDER POLITIK GIMANA BOSS!!! 1. MENDUKUNG CAPRES YG SEBELUMNYA SECARA RESMI DIBERI GELAR TERKIBUL SEINDONESIA. 2. MEMILIH KETUM DGN CARA MENABRAK KAIDAH MORAL POLITIK.,@psi_id Political Blunder How Boss !!!1. Support the presidential candidates who were previously officially given a degree in Indonesia.2. Choosing Ketum by crashing into political moral rules.,Political Blunder How Boss  Support the presidential candidates who were previously officially given a degree in Indonesia  Choosing Ketum by crashing into political moral rules,political blunder how boss  support the presidential candidates who were previously officially given a degree in indonesia  choosing ketum by crashing into political moral rules,political blunder boss support presidential candidates previously officially given degree indonesia choosing ketum crashing political moral rules,"['political', 'blunder', 'boss', 'support', 'presidential', 'candidates', 'previously', 'officially', 'given', 'degree', 'indonesia', 'choosing', 'ketum', 'crashing', 'political', 'moral', 'rules']","['polit', 'blunder', 'boss', 'support', 'presidenti', 'candid', 'previous', 'offici', 'given', 'degre', 'indonesia', 'choos', 'ketum', 'crash', 'polit', 'moral', 'rule']",polit blunder boss support presidenti candid previous offici given degre indonesia choos ketum crash polit moral rule
Mon Apr 22 22:40:54 +0000 2024,@psi_id Meneruskan perjuangan Kartini tapi kadernya banyak pelaku cabul.,@psi_id continued Kartini's struggle but many cadres were obscene.,continued Kartini s struggle but many cadres were obscene,continued kartini s struggle but many cadres were obscene,continued kartini struggle many cadres obscene,"['continued', 'kartini', 'struggle', 'many', 'cadres', 'obscene']","['continu', 'kartini', 'struggl', 'mani', 'cadr', 'obscen']",continu kartini struggl mani cadr obscen
Mon Apr 22 18:24:19 +0000 2024,@DedynurPalakka @jokowi @officialMKRI Fix Jokowi ga punya pengaruh apapun atas kemenangan Prabowo dan Prabowo ga perlu berterima kasih pada Jokowi apalagi PSI,@Dedynurpalakka @jokowi @officialmkri Fix Jokowi has no influence on the victory of Prabowo and Prabowo no need to thank Jokowi especially PSI,Fix Jokowi has no influence on the victory of Prabowo and Prabowo no need to thank Jokowi especially PSI,fix jokowi has no influence on the victory of prabowo and prabowo no need to thank jokowi especially psi,fix jokowi influence victory prabowo prabowo need thank jokowi especially psi,"['fix', 'jokowi', 'influence', 'victory', 'prabowo', 'prabowo', 'need', 'thank', 'jokowi', 'especially', 'psi']","['fix', 'jokowi', 'influenc', 'victori', 'prabowo', 'prabowo', 'need', 'thank', 'jokowi', 'especi', 'psi']",fix jokowi influenc victori prabowo prabowo need thank jokowi especi psi
Mon Apr 22 18:23:38 +0000 2024,@the1mirrorball_ Psi psi,@the1mirrorball_ psi psi,psi psi,psi psi,psi psi,"['psi', 'psi']","['psi', 'psi']",psi psi
Mon Apr 22 18:11:07 +0000 2024,@ASimatupang23 @PDI_Perjuangan @psi_id ngaku partainya Jokowi dan angkat anak Jokowi jadi Ketum dalam waktu singkat... tapi koq nyungsep ???,@Asimimupang23 @pdi_perjuangan @psi_id claimed his party Jokowi and lifted Jokowi's child to be a short time ... but why was it Nyungsep ???,claimed his party Jokowi and lifted Jokowi s child to be a short time but why was it Nyungsep,claimed his party jokowi and lifted jokowi s child to be a short time but why was it nyungsep,claimed party jokowi lifted jokowi child short time nyungsep,"['claimed', 'party', 'jokowi', 'lifted', 'jokowi', 'child', 'short', 'time', 'nyungsep']","['claim', 'parti', 'jokowi', 'lift', 'jokowi', 'child', 'short', 'time', 'nyungsep']",claim parti jokowi lift jokowi child short time nyungsep
Mon Apr 22 17:55:55 +0000 2024,@psi_id Cinta kita untuk bumi adalah warisan terbaik yang bisa kita tinggalkan. Seperti Mas @kaesangp lakukan kebersihan untuk Bumi Indonesia.,@Psi_ID Our Love for the Earth is the best inheritance we can leave.Like Mas @kaesangp do cleanliness for Indonesian earth.,Our Love for the Earth is the best inheritance we can leave Like Masdo cleanliness for Indonesian earth,our love for the earth is the best inheritance we can leave like masdo cleanliness for indonesian earth,love earth best inheritance leave like masdo cleanliness indonesian earth,"['love', 'earth', 'best', 'inheritance', 'leave', 'like', 'masdo', 'cleanliness', 'indonesian', 'earth']","['love', 'earth', 'best', 'inherit', 'leav', 'like', 'masdo', 'cleanli', 'indonesian', 'earth']",love earth best inherit leav like masdo cleanli indonesian earth
Mon Apr 22 17:51:47 +0000 2024,@psi_id Hari ini adalah Hari Bumi. Ayo berkomitmen untuk menjaga alam dengan lebih baik! Bumi sehat generasi sehat. Selamat hari Bumi.,@psi_id today is Earth Day.Come on committed to protect nature better!Healthy Earth Healthy Generation.Happy Earth Day.,today is Earth Day Come on committed to protect nature better Healthy Earth Healthy Generation Happy Earth Day,today is earth day come on committed to protect nature better healthy earth healthy generation happy earth day,today earth day come committed protect nature better healthy earth healthy generation happy earth day,"['today', 'earth', 'day', 'come', 'committed', 'protect', 'nature', 'better', 'healthy', 'earth', 'healthy', 'generation', 'happy', 'earth', 'day']","['today', 'earth', 'day', 'come', 'commit', 'protect', 'natur', 'better', 'healthi', 'earth', 'healthi', 'gener', 'happi', 'earth', 'day']",today earth day come commit protect natur better healthi earth healthi gener happi earth day
Mon Apr 22 17:50:48 +0000 2024,@psi_id Gaspoll psi lanjutkan kegiatan baiknya,@psi_id gaspoll psi continue its good activities,gaspoll psi continue its good activities,gaspoll psi continue its good activities,gaspoll psi continue good activities,"['gaspoll', 'psi', 'continue', 'good', 'activities']","['gaspol', 'psi', 'continu', 'good', 'activ']",gaspol psi continu good activ
Mon Apr 22 17:50:28 +0000 2024,@psi_id Terus jaga bumi ini,@psi_id Continue to guard this earth,Continue to guard this earth,continue to guard this earth,continue guard earth,"['continue', 'guard', 'earth']","['continu', 'guard', 'earth']",continu guard earth
Mon Apr 22 17:50:20 +0000 2024,@psi_id Ngejaga bumi dari hal yang kecil dulu,@psi_id guard the earth from the small thing first,guard the earth from the small thing first,guard the earth from the small thing first,guard earth small thing first,"['guard', 'earth', 'small', 'thing', 'first']","['guard', 'earth', 'small', 'thing', 'first']",guard earth small thing first
Mon Apr 22 17:50:04 +0000 2024,@psi_id Bareng bareng psi jaga bumi,@psi_id together with PSI guard the earth,together with PSI guard the earth,together with psi guard the earth,together psi guard earth,"['together', 'psi', 'guard', 'earth']","['togeth', 'psi', 'guard', 'earth']",togeth psi guard earth
Mon Apr 22 17:49:50 +0000 2024,@psi_id Untuk kebaikan generasi masa depan mari pastikan kehidupan yang lebih baik di masa mendatang dengan menjaga kelestarian alam. #SelamatHariBumi,@psi_id for the good of future generations let's make sure a better life in the future by preserving nature.#Happy Earth Day,for the good of future generations let s make sure a better life in the future by preserving nature Happy Earth Day,for the good of future generations let s make sure a better life in the future by preserving nature happy earth day,good future generations let make sure better life future preserving nature happy earth day,"['good', 'future', 'generations', 'let', 'make', 'sure', 'better', 'life', 'future', 'preserving', 'nature', 'happy', 'earth', 'day']","['good', 'futur', 'gener', 'let', 'make', 'sure', 'better', 'life', 'futur', 'preserv', 'natur', 'happi', 'earth', 'day']",good futur gener let make sure better life futur preserv natur happi earth day
Mon Apr 22 17:49:46 +0000 2024,@psi_id Mantap jaga bumi!,@psi_id great guard the earth!,great guard the earth,great guard the earth,great guard earth,"['great', 'guard', 'earth']","['great', 'guard', 'earth']",great guard earth
Mon Apr 22 17:49:38 +0000 2024,@psi_id Keren yuk jaga kesehatan bumi,@psi_id cool let's take care of the earth's health,cool let s take care of the earth s health,cool let s take care of the earth s health,cool let take care earth health,"['cool', 'let', 'take', 'care', 'earth', 'health']","['cool', 'let', 'take', 'care', 'earth', 'health']",cool let take care earth health
Mon Apr 22 17:49:25 +0000 2024,@psi_id Laksanakan Go green!,@psi_id Carry out Go Green!,Carry out Go Green,carry out go green,carry go green,"['carry', 'go', 'green']","['carri', 'go', 'green']",carri go green
Mon Apr 22 17:49:11 +0000 2024,@psi_id Anak anak muda mesti bisa gerakkan gogreen,@psi_id young people must be able to move gogreen,young people must be able to move gogreen,young people must be able to move gogreen,young people must able move gogreen,"['young', 'people', 'must', 'able', 'move', 'gogreen']","['young', 'peopl', 'must', 'abl', 'move', 'gogreen']",young peopl must abl move gogreen
Mon Apr 22 17:48:52 +0000 2024,@psi_id Selamat hari bumi!,@psi_id Happy Earth Day!,Happy Earth Day,happy earth day,happy earth day,"['happy', 'earth', 'day']","['happi', 'earth', 'day']",happi earth day
Mon Apr 22 17:48:19 +0000 2024,@psi_id Jaga terus bumi kita!,@psi_id keep our earth!,keep our earth,keep our earth,keep earth,"['keep', 'earth']","['keep', 'earth']",keep earth
