created_at,full_text,translate,clean_tweet,lower,stopword,tokenize,stemmed,clean
Mon Apr 15 21:47:29 +0000 2024,@LexWu_13 @dinar_wibowo @psi_id Min @psi_id kicep Bae ga ada suaranya? Apa lagi menikmati selangkangan????,@Lexwu_13 @dinar_wibowo @psi_id min @psi_id kicep bae no sound?What else to enjoy the groin ????,min kicep bae no sound What else to enjoy the groin,min kicep bae no sound what else to enjoy the groin,kicep bae sound else enjoy groin,"['kicep', 'bae', 'sound', 'else', 'enjoy', 'groin']","['kicep', 'bae', 'sound', 'els', 'enjoy', 'groin']",kicep bae sound els enjoy groin
Mon Apr 15 21:38:49 +0000 2024,@AyamSegar3 @Dargomb33306384 @_sekarkinanthi_ @jokowi @gibran_tweet @Gerindra @prabowo @fadlizon @psi_id @kaesangp @golkar_id @golkarpedia @Alitt4mb3ng @AntonKu08408962 @Uki23 @adi_sareang @PartBurungGalak @mikuroQ @T0M5helby @Aryprasetyo85 @hilalmultibiz @SantorinisSun @adearmando61 @budimandjatmiko Gmn ga ngeGas. Perihal konteks sederhana MENUNGGU aja otak lu pada kagak nyampe mikirnya. Aye kagak bakalan ngeGas klo kepala elu yg kosong itu bisa diajak MIKIR. Ngiahahhahahhahahaa,"@Ayamsegar3 @dargomb33306384 @_sekarkinanthi_ @jokowi @gibran_tweet @gerindra @prabowo @fadlizon @psi_id @kaesangp @golkar_id @golkarpedia @alitt4mb3ng @antonku08408962 5helby @aryprasetyo85 @hilalmultibiz @santorinissun @adearmando61 @budimandjatmikoNgapan.Regarding the simple context, just waiting for your brain to think about it.Aye will not emphasize if the empty head can be invited to think.Ngiahahahahahahahaaa",helby Regarding the simple context just waiting for your brain to think about it Aye will not emphasize if the empty head can be invited to think Ngiahahahahahahahaaa,helby regarding the simple context just waiting for your brain to think about it aye will not emphasize if the empty head can be invited to think ngiahahahahahahahaaa,helby regarding simple context waiting brain think aye emphasize empty head invited think ngiahahahahahahahaaa,"['helby', 'regarding', 'simple', 'context', 'waiting', 'brain', 'think', 'aye', 'emphasize', 'empty', 'head', 'invited', 'think', 'ngiahahahahahahahaaa']","['helbi', 'regard', 'simpl', 'context', 'wait', 'brain', 'think', 'aye', 'emphas', 'empti', 'head', 'invit', 'think', 'ngiahahahahahahahaaa']",helbi regard simpl context wait brain think aye emphas empti head invit think ngiahahahahahahahaaa
Mon Apr 15 21:37:35 +0000 2024,@hilalmultibiz @_sekarkinanthi_ @jokowi @gibran_tweet @Gerindra @prabowo @fadlizon @psi_id @kaesangp @golkar_id @golkarpedia @Alitt4mb3ng @AntonKu08408962 @Uki23 @adi_sareang @AyamSegar3 @PartBurungGalak @mikuroQ @T0M5helby @Aryprasetyo85 @SantorinisSun @adearmando61 @budimandjatmiko Kan tau klo itu bakal melanggar aturan. Klo emang punya pendirian teguh &amp; patuh harusnya sejak awal ga perlu nunggu kan? Menunggu artinya ada harapan ternyata harapannya dialihkan ke Mahfud MD. Lha skrng malah marah2 sama kemenangan mantan. Ngiahhahhahahhahaaa,"@hilalmultibiz @_sekarkinanthi_ @jokowi @gibran_tweet @gerindra @prabowo @fadlizon @psi_id @kaesangp @golkar_id @golkarpedia @alitt4mb3ng @antonku08408962 @uli elby @aryprasetyo85 @santorinissun @adearmando61 @budimandjatmiko you know if thatwill break the rules.If you have a firm stand & amp;Should obey from the beginning, you don't need to wait, right?Waiting for the meaning of hope that his hope was transferred to Mahfud MD.Now even angry with the ex -victory of the ex.Ngiahhahhahahahahaaaa",elbyyou know if thatwill break the rules If you have a firm stand amp Should obey from the beginning you don t need to wait right Waiting for the meaning of hope that his hope was transferred to Mahfud MD Now even angry with the ex victory of the ex Ngiahhahhahahahahaaaa,elbyyou know if thatwill break the rules if you have a firm stand amp should obey from the beginning you don t need to wait right waiting for the meaning of hope that his hope was transferred to mahfud md now even angry with the ex victory of the ex ngiahhahhahahahahaaaa,elbyyou know thatwill break rules firm stand amp obey beginning need wait right waiting meaning hope hope transferred mahfud md even angry ex victory ex ngiahhahhahahahahaaaa,"['elbyyou', 'know', 'thatwill', 'break', 'rules', 'firm', 'stand', 'amp', 'obey', 'beginning', 'need', 'wait', 'right', 'waiting', 'meaning', 'hope', 'hope', 'transferred', 'mahfud', 'md', 'even', 'angry', 'ex', 'victory', 'ex', 'ngiahhahhahahahahaaaa']","['elbyy', 'know', 'thatwil', 'break', 'rule', 'firm', 'stand', 'amp', 'obey', 'begin', 'need', 'wait', 'right', 'wait', 'mean', 'hope', 'hope', 'transfer', 'mahfud', 'md', 'even', 'angri', 'ex', 'victori', 'ex', 'ngiahhahhahahahahaaaa']",elbyy know thatwil break rule firm stand amp obey begin need wait right wait mean hope hope transfer mahfud md even angri ex victori ex ngiahhahhahahahahaaaa
Mon Apr 15 21:35:43 +0000 2024,@Dargomb33306384 @AyamSegar3 @AntonKu08408962 @_sekarkinanthi_ @jokowi @gibran_tweet @Gerindra @prabowo @fadlizon @psi_id @kaesangp @golkar_id @golkarpedia @Alitt4mb3ng @Uki23 @adi_sareang @PartBurungGalak @mikuroQ @T0M5helby @Aryprasetyo85 @hilalmultibiz @SantorinisSun @adearmando61 @budimandjatmiko Jauh2 hari Jokowi kasih sinyal klo penerusnya itu antara Prabowo &amp; Ganjar. Dia mau menggabungkan keduanya. Emak Bull kagak mau kesombongan &amp; kepongahannya bikin dia tinggi hati &amp; menolak klausul Ganjar jadi wapres dulu periode berikutnya baru naik presiden. Akar rumput ga tau.,@Dargomb33306384 @Ayamsegar3 @antonku08408962 @_sekarkinanthi_ @jokowi @gibran_tweet @gerindra @prabowo @fadlizon @psi_id @kaesangp @golkar_id @golkarpedia @alitt4mb3ng 5helby @aryprasetyo85 @hilalmultibiz @santorinissun @adearmando61 @budimandjatmiko far awayJokowi gave a signal if his successor was between Prabowo & amp;Ganjar.He wants to combine the two.Mother Bull I don't want pride & amp;His pounding made him high heart & amp;Refusing the Ganjar clause to become the vice president first the next period and then took the president.The grass roots don't know.,helbyfar awayJokowi gave a signal if his successor was between Prabowo amp Ganjar He wants to combine the two Mother Bull I don t want pride amp His pounding made him high heart amp Refusing the Ganjar clause to become the vice president first the next period and then took the president The grass roots don t know,helbyfar awayjokowi gave a signal if his successor was between prabowo amp ganjar he wants to combine the two mother bull i don t want pride amp his pounding made him high heart amp refusing the ganjar clause to become the vice president first the next period and then took the president the grass roots don t know,helbyfar awayjokowi gave signal successor prabowo amp ganjar wants combine two mother bull want pride amp pounding made high heart amp refusing ganjar clause become vice president first next period took president grass roots know,"['helbyfar', 'awayjokowi', 'gave', 'signal', 'successor', 'prabowo', 'amp', 'ganjar', 'wants', 'combine', 'two', 'mother', 'bull', 'want', 'pride', 'amp', 'pounding', 'made', 'high', 'heart', 'amp', 'refusing', 'ganjar', 'clause', 'become', 'vice', 'president', 'first', 'next', 'period', 'took', 'president', 'grass', 'roots', 'know']","['helbyfar', 'awayjokowi', 'gave', 'signal', 'successor', 'prabowo', 'amp', 'ganjar', 'want', 'combin', 'two', 'mother', 'bull', 'want', 'pride', 'amp', 'pound', 'made', 'high', 'heart', 'amp', 'refus', 'ganjar', 'claus', 'becom', 'vice', 'presid', 'first', 'next', 'period', 'took', 'presid', 'grass', 'root', 'know']",helbyfar awayjokowi gave signal successor prabowo amp ganjar want combin two mother bull want pride amp pound made high heart amp refus ganjar claus becom vice presid first next period took presid grass root know
Mon Apr 15 21:33:46 +0000 2024,@Dargomb33306384 @AyamSegar3 @AntonKu08408962 @_sekarkinanthi_ @jokowi @gibran_tweet @Gerindra @prabowo @fadlizon @psi_id @kaesangp @golkar_id @golkarpedia @Alitt4mb3ng @Uki23 @adi_sareang @PartBurungGalak @mikuroQ @T0M5helby @Aryprasetyo85 @hilalmultibiz @SantorinisSun @adearmando61 @budimandjatmiko Anak muda yg berkompeten &amp; progresif akan lompat pagar klo dipersulit oleh partai kuno gtu. Ingat @EmilDardak bupati Trenggalek dr PDIP. Dia milih nyebrang ke Demokrat &amp; maju wagub bareng Khofifah &amp; menang. Kawannya Puti Guntur ponakannye Emak Bull. Banteng partai usang &amp; kaku.,@Dargomb33306384 @Ayamsegar3 @antonku08408962 @_sekarkinanthi_ @jokowi @gibran_tweet @gerindra @prabowo @fadlizon 5helby @aryprasetyo85 @hilalmultibiz @santorinissun @adearmando61 @budimandjatmiko young peoplecompetent & amp;Progressive will jump fence if it is complicated by an ancient party.Remember @emildardak Trenggalek Regent Dr. PDIP.He chose to cross into Democrats & amp;Forward Deputy Governor with Khofifah & amp;win.His friend Puti Guntur Puchye Mother Bull.Oddly Party Bull & amp;rigid.,helbyyoung peoplecompetent amp Progressive will jump fence if it is complicated by an ancient party RememberTrenggalek Regent Dr PDIP He chose to cross into Democrats amp Forward Deputy Governor with Khofifah amp win His friend Puti Guntur Puchye Mother Bull Oddly Party Bull amp rigid,helbyyoung peoplecompetent amp progressive will jump fence if it is complicated by an ancient party remembertrenggalek regent dr pdip he chose to cross into democrats amp forward deputy governor with khofifah amp win his friend puti guntur puchye mother bull oddly party bull amp rigid,helbyyoung peoplecompetent amp progressive jump fence complicated ancient party remembertrenggalek regent pdip chose cross democrats amp forward deputy governor khofifah amp win friend puti guntur puchye mother bull oddly party bull amp rigid,"['helbyyoung', 'peoplecompetent', 'amp', 'progressive', 'jump', 'fence', 'complicated', 'ancient', 'party', 'remembertrenggalek', 'regent', 'pdip', 'chose', 'cross', 'democrats', 'amp', 'forward', 'deputy', 'governor', 'khofifah', 'amp', 'win', 'friend', 'puti', 'guntur', 'puchye', 'mother', 'bull', 'oddly', 'party', 'bull', 'amp', 'rigid']","['helbyyoung', 'peoplecompet', 'amp', 'progress', 'jump', 'fenc', 'complic', 'ancient', 'parti', 'remembertrenggalek', 'regent', 'pdip', 'chose', 'cross', 'democrat', 'amp', 'forward', 'deputi', 'governor', 'khofifah', 'amp', 'win', 'friend', 'puti', 'guntur', 'puchy', 'mother', 'bull', 'oddli', 'parti', 'bull', 'amp', 'rigid']",helbyyoung peoplecompet amp progress jump fenc complic ancient parti remembertrenggalek regent pdip chose cross democrat amp forward deputi governor khofifah amp win friend puti guntur puchy mother bull oddli parti bull amp rigid
Mon Apr 15 21:31:18 +0000 2024,@Dargomb33306384 @AyamSegar3 @AntonKu08408962 @_sekarkinanthi_ @jokowi @gibran_tweet @Gerindra @prabowo @fadlizon @psi_id @kaesangp @golkar_id @golkarpedia @Alitt4mb3ng @Uki23 @adi_sareang @PartBurungGalak @mikuroQ @T0M5helby @Aryprasetyo85 @hilalmultibiz @SantorinisSun @adearmando61 @budimandjatmiko Situh siapa bisa mengartikan statement Puan sebagai diplomasi politik? Apapun itu Puan Nunggu keputusan MK artinya masih berharap Gibran jadi cawapresnya. 3 hari pasca keputusan eh malah milih mahfud ya Prabowo yg ambil Gibran kayak anak2 ingusan luh berpolitiknya. Ngambekan.,"@Dargomb33306384 @Ayamsegar3 @antonku08408962 @_sekarkinanthi_ @jokowi @gibran_tweet @gerindra @prabowo @fadlizon 5helby @aryprasetyo85 @hilalmultibiz @santorinissun @adearmando61 @budimandjatmiko situh whoCan interpret Puan's statement as a political diplomacy?Whatever is Puan waiting for the MK's decision, it still hopes that Gibran will be his running mate.3 days after the decision eh even chose Mahfud, Prabowo who took Gibran like the nose children in politics.Sulking.",helbysituh whoCan interpret Puan s statement as a political diplomacy Whatever is Puan waiting for the MK s decision it still hopes that Gibran will be his running mate  days after the decision eh even chose Mahfud Prabowo who took Gibran like the nose children in politics Sulking,helbysituh whocan interpret puan s statement as a political diplomacy whatever is puan waiting for the mk s decision it still hopes that gibran will be his running mate  days after the decision eh even chose mahfud prabowo who took gibran like the nose children in politics sulking,helbysituh whocan interpret puan statement political diplomacy whatever puan waiting mk decision still hopes gibran running mate days decision even chose mahfud prabowo took gibran like nose children politics sulking,"['helbysituh', 'whocan', 'interpret', 'puan', 'statement', 'political', 'diplomacy', 'whatever', 'puan', 'waiting', 'mk', 'decision', 'still', 'hopes', 'gibran', 'running', 'mate', 'days', 'decision', 'even', 'chose', 'mahfud', 'prabowo', 'took', 'gibran', 'like', 'nose', 'children', 'politics', 'sulking']","['helbysituh', 'whocan', 'interpret', 'puan', 'statement', 'polit', 'diplomaci', 'whatev', 'puan', 'wait', 'mk', 'decis', 'still', 'hope', 'gibran', 'run', 'mate', 'day', 'decis', 'even', 'chose', 'mahfud', 'prabowo', 'took', 'gibran', 'like', 'nose', 'children', 'polit', 'sulk']",helbysituh whocan interpret puan statement polit diplomaci whatev puan wait mk decis still hope gibran run mate day decis even chose mahfud prabowo took gibran like nose children polit sulk
Mon Apr 15 18:37:26 +0000 2024,hari ini di fore lagi! tapi ga sampai malem bgt karna tiba gerd menyerang‍ ngerjain latsol alter to sainsin dan tambahan inten https://t.co/4fpqPgcxTi,Today at Fore again!but it didn't get late because it arrived Gerd attacking latsol alter to sainsin and additional inten https://t.co/4fpqpgcxti,Today at Fore again but it didn t get late because it arrived Gerd attacking latsol alter to sainsin and additional inten https t co fpqpgcxti,today at fore again but it didn t get late because it arrived gerd attacking latsol alter to sainsin and additional inten https t co fpqpgcxti,today fore get late arrived gerd attacking latsol alter sainsin additional inten https co fpqpgcxti,"['today', 'fore', 'get', 'late', 'arrived', 'gerd', 'attacking', 'latsol', 'alter', 'sainsin', 'additional', 'inten', 'https', 'co', 'fpqpgcxti']","['today', 'fore', 'get', 'late', 'arriv', 'gerd', 'attack', 'latsol', 'alter', 'sainsin', 'addit', 'inten', 'http', 'co', 'fpqpgcxti']",today fore get late arriv gerd attack latsol alter sainsin addit inten http co fpqpgcxti
Mon Apr 15 18:35:59 +0000 2024,Ga aneh sih partai ini di bentuk awalnya untuk pro ahok n anti fpi. Jd tau sendirilah bagaimana kira2 cara seleksi anggotanya @psi,"It's not strange that this party was initially formed for Pro Ahok N Anti FPI.So you know, how do you think about the selection of its members @psi",It s not strange that this party was initially formed for Pro Ahok N Anti FPI So you know how do you think about the selection of its members,it s not strange that this party was initially formed for pro ahok n anti fpi so you know how do you think about the selection of its members,strange party initially formed pro ahok n anti fpi know think selection members,"['strange', 'party', 'initially', 'formed', 'pro', 'ahok', 'n', 'anti', 'fpi', 'know', 'think', 'selection', 'members']","['strang', 'parti', 'initi', 'form', 'pro', 'ahok', 'n', 'anti', 'fpi', 'know', 'think', 'select', 'member']",strang parti initi form pro ahok n anti fpi know think select member
Mon Apr 15 18:29:12 +0000 2024,@thtsblue terimakasiih banyakk,@thtsblue Thank you very much,Thank you very much,thank you very much,thank much,"['thank', 'much']","['thank', 'much']",thank much
Mon Apr 15 18:29:00 +0000 2024,@moonsaturnzz aamiin ya Allah semogaa kamu juga yaa Reta,"@moonsurnurnzz aamiin ya Allah, I hope you are too Reta",aamiin ya Allah I hope you are too Reta,aamiin ya allah i hope you are too reta,aamiin allah hope reta,"['aamiin', 'allah', 'hope', 'reta']","['aamiin', 'allah', 'hope', 'reta']",aamiin allah hope reta
Mon Apr 15 18:29:00 +0000 2024,@psi_id sok bijak binatang,@psi_id pretentious animals,pretentious animals,pretentious animals,pretentious animals,"['pretentious', 'animals']","['pretenti', 'anim']",pretenti anim
Mon Apr 15 18:28:29 +0000 2024,@txtdariFUSIxFMA aaaa ya Allah aamiinn tungguu aku yaa miinn,@txtdarifusixfma aaaa oh Allah aamiinn wait me yaa miinn,aaaa oh Allah aamiinn wait me yaa miinn,aaaa oh allah aamiinn wait me yaa miinn,aaaa oh allah aamiinn wait yaa miinn,"['aaaa', 'oh', 'allah', 'aamiinn', 'wait', 'yaa', 'miinn']","['aaaa', 'oh', 'allah', 'aamiinn', 'wait', 'yaa', 'miinn']",aaaa oh allah aamiinn wait yaa miinn
Mon Apr 15 18:27:37 +0000 2024,@unsterimaak aamiin ya Allah,@unSTerimaak Aamiin O Allah,Aamiin O Allah,aamiin o allah,aamiin allah,"['aamiin', 'allah']","['aamiin', 'allah']",aamiin allah
Mon Apr 15 18:27:14 +0000 2024,@bithistorymaker aamiin ya Allah makasii banyak yaa,"@bithistorymaker Aamiin O Allah, thanks a lot",Aamiin O Allah thanks a lot,aamiin o allah thanks a lot,aamiin allah thanks lot,"['aamiin', 'allah', 'thanks', 'lot']","['aamiin', 'allah', 'thank', 'lot']",aamiin allah thank lot
Mon Apr 15 18:26:14 +0000 2024,@lgdipomuda24 aamiin calla terimakasiih banyaak yaa,@lgdipomuda24 aamiin calla thank you very much,aamiin calla thank you very much,aamiin calla thank you very much,aamiin calla thank much,"['aamiin', 'calla', 'thank', 'much']","['aamiin', 'calla', 'thank', 'much']",aamiin calla thank much
Mon Apr 15 18:25:54 +0000 2024,@resqectable aamiin ya Allah makasi banyaak ayshaa,@resquectable aamiin ya Allah thanks a lot of aysha,aamiin ya Allah thanks a lot of aysha,aamiin ya allah thanks a lot of aysha,aamiin allah thanks lot aysha,"['aamiin', 'allah', 'thanks', 'lot', 'aysha']","['aamiin', 'allah', 'thank', 'lot', 'aysha']",aamiin allah thank lot aysha
Mon Apr 15 18:15:37 +0000 2024,@CalyaKendra akk mauu daftar psi sprtinya,@Calayendra AKK Want a list,AKK Want a list,akk want a list,akk want list,"['akk', 'want', 'list']","['akk', 'want', 'list']",akk want list
Mon Apr 15 18:13:03 +0000 2024,sama persis semoga skornya nular kak ,"exactly the same, hopefully the score is infectious sis",exactly the same hopefully the score is infectious sis,exactly the same hopefully the score is infectious sis,exactly hopefully score infectious sis,"['exactly', 'hopefully', 'score', 'infectious', 'sis']","['exactli', 'hope', 'score', 'infecti', 'si']",exactli hope score infecti si
Mon Apr 15 18:03:43 +0000 2024,@txtdariFUSIxFMA @batakjakun terima kasih banyak etminnnn ,@txtdarifusixfma @batakjakun thank you very much etminnnn,thank you very much etminnnn,thank you very much etminnnn,thank much etminnnn,"['thank', 'much', 'etminnnn']","['thank', 'much', 'etminnnn']",thank much etminnnn
Mon Apr 15 18:01:51 +0000 2024,@bacottetangga_ @idextratime Bikinlah woi @Gerindra @golkarpedia @PKSejahtera @DPP_PKB @PDI_Perjuangan @PDemokrat @NasDem @Official_PAN riil suara akar rumput ini loh ketua2 Benalu @psi_id gakusah ikut2an ya,@bacottetangga_ @idextratime make woi @gerindra @golkarpedia @pksejahtera @dpp_pkb @pdi_perjuangan @pdemokrat @nasdem @official_pan real sound root grassroots.,make woireal sound root grassroots,make woireal sound root grassroots,make woireal sound root grassroots,"['make', 'woireal', 'sound', 'root', 'grassroots']","['make', 'woireal', 'sound', 'root', 'grassroot']",make woireal sound root grassroot
Mon Apr 15 18:01:23 +0000 2024,@choialwa lah beneran ada opini seperti ini toh,@choialwa is really an opinion like this anyway,is really an opinion like this anyway,is really an opinion like this anyway,really opinion like anyway,"['really', 'opinion', 'like', 'anyway']","['realli', 'opinion', 'like', 'anyway']",realli opinion like anyway
Mon Apr 15 18:00:23 +0000 2024,@Uki23 Bro apakah benar PSI itu singkatan dari Partai Selangkangan Indah? Mau tanya saja karena pentolan2 partai kalian banyak terkena kasus selangkangan.,@Uki23 Bro Is it true that PSI stands for a beautiful groin party?Just want to ask because your party frontman is exposed to a lot of groin cases.,Bro Is it true that PSI stands for a beautiful groin party Just want to ask because your party frontman is exposed to a lot of groin cases,bro is it true that psi stands for a beautiful groin party just want to ask because your party frontman is exposed to a lot of groin cases,bro true psi stands beautiful groin party want ask party frontman exposed lot groin cases,"['bro', 'true', 'psi', 'stands', 'beautiful', 'groin', 'party', 'want', 'ask', 'party', 'frontman', 'exposed', 'lot', 'groin', 'cases']","['bro', 'true', 'psi', 'stand', 'beauti', 'groin', 'parti', 'want', 'ask', 'parti', 'frontman', 'expos', 'lot', 'groin', 'case']",bro true psi stand beauti groin parti want ask parti frontman expos lot groin case
Mon Apr 15 17:58:10 +0000 2024,@Uki23 PSI partai minim prestasi bisanya nyela orang aja..,@Uki23 PSI Party minimal achievements usually just relax ..,PSI Party minimal achievements usually just relax,psi party minimal achievements usually just relax,psi party minimal achievements usually relax,"['psi', 'party', 'minimal', 'achievements', 'usually', 'relax']","['psi', 'parti', 'minim', 'achiev', 'usual', 'relax']",psi parti minim achiev usual relax
Mon Apr 15 17:00:25 +0000 2024,@LexWu_13 @psi_id Pantesan tokoh bersih PSI pada mundur ya Yg Bertahan TOKOH BURUK semua,@Lexwu_13 @psi_id Pantesan PSI Clean Figure in Resign,Pantesan PSI Clean Figure in Resign,pantesan psi clean figure in resign,pantesan psi clean figure resign,"['pantesan', 'psi', 'clean', 'figure', 'resign']","['pantesan', 'psi', 'clean', 'figur', 'resign']",pantesan psi clean figur resign
Mon Apr 15 16:59:32 +0000 2024,@yoowpa @ikanselmon km psi kh,@yoowpa @kanselmon km psi kh,km psi kh,km psi kh,km psi kh,"['km', 'psi', 'kh']","['km', 'psi', 'kh']",km psi kh
Mon Apr 15 16:53:16 +0000 2024,@psi_id Kami simpatisan PDIP tidak ikhlas Ki Jokobodo bertemu Tante Ega. Kalo tetap memaksa bertemu maka kami tentu akan berpikir ulang jadi simpatisan PDIP. Kamu simpatisan PDIP sakit hati boangat sama Kijokobodo sekarang jadi jijik liat kijokobo ditelevisi..,"@psi_id we sympathizers PDIP is not sincere Ki Jokobodo meets Aunt Ega.If we still force to meet, we will certainly think again to be a PDIP sympathizer.You sympathizes PDIP hurts very hurt the same Kijokobodo now so disgusted seeing Kijokobo in television ..",we sympathizers PDIP is not sincere Ki Jokobodo meets Aunt Ega If we still force to meet we will certainly think again to be a PDIP sympathizer You sympathizes PDIP hurts very hurt the same Kijokobodo now so disgusted seeing Kijokobo in television,we sympathizers pdip is not sincere ki jokobodo meets aunt ega if we still force to meet we will certainly think again to be a pdip sympathizer you sympathizes pdip hurts very hurt the same kijokobodo now so disgusted seeing kijokobo in television,sympathizers pdip sincere ki jokobodo meets aunt ega still force meet certainly think pdip sympathizer sympathizes pdip hurts hurt kijokobodo disgusted seeing kijokobo television,"['sympathizers', 'pdip', 'sincere', 'ki', 'jokobodo', 'meets', 'aunt', 'ega', 'still', 'force', 'meet', 'certainly', 'think', 'pdip', 'sympathizer', 'sympathizes', 'pdip', 'hurts', 'hurt', 'kijokobodo', 'disgusted', 'seeing', 'kijokobo', 'television']","['sympath', 'pdip', 'sincer', 'ki', 'jokobodo', 'meet', 'aunt', 'ega', 'still', 'forc', 'meet', 'certainli', 'think', 'pdip', 'sympath', 'sympath', 'pdip', 'hurt', 'hurt', 'kijokobodo', 'disgust', 'see', 'kijokobo', 'televis']",sympath pdip sincer ki jokobodo meet aunt ega still forc meet certainli think pdip sympath sympath pdip hurt hurt kijokobodo disgust see kijokobo televis
Mon Apr 15 16:50:04 +0000 2024,@psi_id Buka KEBOHONGAN selama ini tersimpan,@psi_id open lies so far stored,open lies so far stored,open lies so far stored,open lies far stored,"['open', 'lies', 'far', 'stored']","['open', 'lie', 'far', 'store']",open lie far store
Mon Apr 15 16:48:07 +0000 2024,Jadi Tersangka Pelecehan Seksual Ketua DPC PSI Gubeng Surabaya Dipecat https://t.co/xcCyIRmJXa,So a suspect in sexual harassment Chairman of DPC PSI Gubeng Surabaya was fired https://t.co/xccyirmi,So a suspect in sexual harassment Chairman of DPC PSI Gubeng Surabaya was fired https t co xccyirmi,so a suspect in sexual harassment chairman of dpc psi gubeng surabaya was fired https t co xccyirmi,suspect sexual harassment chairman dpc psi gubeng surabaya fired https co xccyirmi,"['suspect', 'sexual', 'harassment', 'chairman', 'dpc', 'psi', 'gubeng', 'surabaya', 'fired', 'https', 'co', 'xccyirmi']","['suspect', 'sexual', 'harass', 'chairman', 'dpc', 'psi', 'gubeng', 'surabaya', 'fire', 'http', 'co', 'xccyirmi']",suspect sexual harass chairman dpc psi gubeng surabaya fire http co xccyirmi
Mon Apr 15 16:42:15 +0000 2024,@Anak__Ogi @psi_id @Uki23 @jokowi Si uki kan buzzer mencla mencleyg penting nyebokin dan koar2,@Anak__ogi @psi_id @uki23 @jokowi in uki right buzzer mendla miele is the important thing,in uki right buzzer mendla miele is the important thing,in uki right buzzer mendla miele is the important thing,uki right buzzer mendla miele important thing,"['uki', 'right', 'buzzer', 'mendla', 'miele', 'important', 'thing']","['uki', 'right', 'buzzer', 'mendla', 'miel', 'import', 'thing']",uki right buzzer mendla miel import thing
Mon Apr 15 16:35:38 +0000 2024,@yosua_purba @jokowi @psi_id Demi anak mantu,@yosua_purba @jokowi @psi_id for son -in -law,for son in law,for son in law,son law,"['son', 'law']","['son', 'law']",son law
Mon Apr 15 16:31:39 +0000 2024,@ihe4rthanji OMG MUTUALANKU YG DULU HAHAHA sekarang udah jadi maba psi yeee,@iHe4trthanji omg of my old quality hahaha now has become a freshman psi yeee,omg of my old quality hahaha now has become a freshman psi yeee,omg of my old quality hahaha now has become a freshman psi yeee,omg old quality hahaha become freshman psi yeee,"['omg', 'old', 'quality', 'hahaha', 'become', 'freshman', 'psi', 'yeee']","['omg', 'old', 'qualiti', 'hahaha', 'becom', 'freshman', 'psi', 'yeee']",omg old qualiti hahaha becom freshman psi yeee
