created_at,full_text,translate,clean_tweet,lower,stopword,tokenize,stemmed,clean
Mon Mar 25 23:35:31 +0000 2024,@aly_benzema @Boedoet12489730 @psi_id @grace_nat @Giring_Ganesha @Uki23 Sekarang mereka bisu... https://t.co/9PmfvtrMxB,@aly_benzema @boedoet12489730 @psi_id @grace_nat @giring_anesha @uki23 now they are mute ... https://t.co/9pmfvtrmxb,now they are mute https t co pmfvtrmxb,now they are mute https t co pmfvtrmxb,mute https co pmfvtrmxb,"['mute', 'https', 'co', 'pmfvtrmxb']","['mute', 'http', 'co', 'pmfvtrmxb']",mute http co pmfvtrmxb
Mon Mar 25 23:32:57 +0000 2024,@PancaNada @FaGtng @hannysilvie Masih ada PSI di Pileg...,@Pancanada @fagtng @hannysilvie still has a psi in the legislative election ...,still has a psi in the legislative election,still has a psi in the legislative election,still psi legislative election,"['still', 'psi', 'legislative', 'election']","['still', 'psi', 'legisl', 'elect']",still psi legisl elect
Mon Mar 25 23:31:35 +0000 2024,@psi_id Ketum kalian knapa jarang tampil? Apa balik lagi jadi tukang martabak?,@psi_id Ketum are you guys rarely appear?Is it back to being a martabak?,Ketum are you guys rarely appear Is it back to being a martabak,ketum are you guys rarely appear is it back to being a martabak,ketum guys rarely appear back martabak,"['ketum', 'guys', 'rarely', 'appear', 'back', 'martabak']","['ketum', 'guy', 'rare', 'appear', 'back', 'martabak']",ketum guy rare appear back martabak
Mon Mar 25 23:29:45 +0000 2024,@FelixSGL1 @mdrfhyt Iya tapi kayaknya si wowo mau mnegurangi pengaruh jokowi makanya kayaknya mentri psi paling jadi wakli gak jadi ketia hahahahah,"@Felixsgl1 @mdrfhyt yes but I think the wowo wants to reduce the influence of Jokowi, so it seems like the minister of PSI is the most wakli so it doesn't become hahahahahah",yes but I think the wowo wants to reduce the influence of Jokowi so it seems like the minister of PSI is the most wakli so it doesn t become hahahahahah,yes but i think the wowo wants to reduce the influence of jokowi so it seems like the minister of psi is the most wakli so it doesn t become hahahahahah,yes think wowo wants reduce influence jokowi seems like minister psi wakli become hahahahahah,"['yes', 'think', 'wowo', 'wants', 'reduce', 'influence', 'jokowi', 'seems', 'like', 'minister', 'psi', 'wakli', 'become', 'hahahahahah']","['ye', 'think', 'wowo', 'want', 'reduc', 'influenc', 'jokowi', 'seem', 'like', 'minist', 'psi', 'wakli', 'becom', 'hahahahahah']",ye think wowo want reduc influenc jokowi seem like minist psi wakli becom hahahahahah
Mon Mar 25 23:29:11 +0000 2024,@mesheviksus2 @mdrfhyt PBB mana kuat. Partai sangat kecil gitu berantem dah ama PSI,@mesheviks2 @mdrfhyt PBB where is strong.The party is very small so fighting and psi,PBB where is strong The party is very small so fighting and psi,pbb where is strong the party is very small so fighting and psi,pbb strong party small fighting psi,"['pbb', 'strong', 'party', 'small', 'fighting', 'psi']","['pbb', 'strong', 'parti', 'small', 'fight', 'psi']",pbb strong parti small fight psi
Mon Mar 25 23:27:50 +0000 2024,@FelixSGL1 @mdrfhyt Kayaknya demokrat juga dianak tirikan kayak psi. Awokwaw palingan golkar-gerindra-pan-pbb-perindo(kalau gabung pemerintah),@Felixsgl1 @mdrfhyt I think Democrats are also died like PSI.Awokwaw Palingan Golkar-Gerindra-PAN-PBB-Perindo (if you join the government),I think Democrats are also died like PSI Awokwaw Palingan Golkar Gerindra PAN PBB Perindo if you join the government,i think democrats are also died like psi awokwaw palingan golkar gerindra pan pbb perindo if you join the government,think democrats also died like psi awokwaw palingan golkar gerindra pan pbb perindo join government,"['think', 'democrats', 'also', 'died', 'like', 'psi', 'awokwaw', 'palingan', 'golkar', 'gerindra', 'pan', 'pbb', 'perindo', 'join', 'government']","['think', 'democrat', 'also', 'die', 'like', 'psi', 'awokwaw', 'palingan', 'golkar', 'gerindra', 'pan', 'pbb', 'perindo', 'join', 'govern']",think democrat also die like psi awokwaw palingan golkar gerindra pan pbb perindo join govern
Mon Mar 25 23:27:27 +0000 2024,PSI or GOLKAR? ,Psi or Golkar?,Psi or Golkar,psi or golkar,psi golkar,"['psi', 'golkar']","['psi', 'golkar']",psi golkar
Mon Mar 25 23:25:22 +0000 2024,@psi_id Omongan basi. Kalo bukan karena bapaknya apa bisa?? Saya lebis stuju malah sis yg maju lebih ok,"@psi_id stale talk.If not because of the father what can ??I was even more, even the sis who advanced was more ok",stale talk If not because of the father what can I was even more even the sis who advanced was more ok,stale talk if not because of the father what can i was even more even the sis who advanced was more ok,stale talk father even even sis advanced ok,"['stale', 'talk', 'father', 'even', 'even', 'sis', 'advanced', 'ok']","['stale', 'talk', 'father', 'even', 'even', 'si', 'advanc', 'ok']",stale talk father even even si advanc ok
Mon Mar 25 23:25:10 +0000 2024,@DedynurPalakka @mulanbilqis @psi_id Ide berhutang tanpa beban,@Dedynurpalakka @mulanbilqis @psi_id Idee of debt without burden,Idee of debt without burden,idee of debt without burden,idee debt without burden,"['idee', 'debt', 'without', 'burden']","['ide', 'debt', 'without', 'burden']",ide debt without burden
Mon Mar 25 23:15:43 +0000 2024,@ch_chotimah2 Keberadaan mereka didunia perpolikan indonesia; Ganjar PDIP brp thn? PSI brp thn?,@ch_chotimah2 Their existence in the world of Indonesian politics;Ganjar PDIP bro?Psi brp yr?,Their existence in the world of Indonesian politics Ganjar PDIP bro Psi brp yr,their existence in the world of indonesian politics ganjar pdip bro psi brp yr,existence world indonesian politics ganjar pdip bro psi yr,"['existence', 'world', 'indonesian', 'politics', 'ganjar', 'pdip', 'bro', 'psi', 'yr']","['exist', 'world', 'indonesian', 'polit', 'ganjar', 'pdip', 'bro', 'psi', 'yr']",exist world indonesian polit ganjar pdip bro psi yr
Mon Mar 25 23:13:01 +0000 2024,@psi_id Partai yg ga Punya Ideologi dan hanya bisa menjilat aja Pantas ga bisa masuk ke Senayan,@psi_id party that doesn't have ideology and can only lick it worthy of not being able to enter Senayan,party that doesn t have ideology and can only lick it worthy of not being able to enter Senayan,party that doesn t have ideology and can only lick it worthy of not being able to enter senayan,party ideology lick worthy able enter senayan,"['party', 'ideology', 'lick', 'worthy', 'able', 'enter', 'senayan']","['parti', 'ideolog', 'lick', 'worthi', 'abl', 'enter', 'senayan']",parti ideolog lick worthi abl enter senayan
Mon Mar 25 23:08:48 +0000 2024,@DedynurPalakka @mulanbilqis @psi_id Ide apa ? Ide soal bgmn spy seluruh keluarga berkuasa ? Bgmn politik dinasti merebak ? Silahkan Psi menjilat kita lihat apa rakyat setuju dg ide jkwi.,@Dedynurpalakka @mulanbilqis @psi_id What idea?Ideas about spy spy all families in power?How about dynastic politics spread?Please psi lick us to see if the people agree with JKWI's ideas.,What idea Ideas about spy spy all families in power How about dynastic politics spread Please psi lick us to see if the people agree with JKWI s ideas,what idea ideas about spy spy all families in power how about dynastic politics spread please psi lick us to see if the people agree with jkwi s ideas,idea ideas spy spy families power dynastic politics spread please psi lick us see people agree jkwi ideas,"['idea', 'ideas', 'spy', 'spy', 'families', 'power', 'dynastic', 'politics', 'spread', 'please', 'psi', 'lick', 'us', 'see', 'people', 'agree', 'jkwi', 'ideas']","['idea', 'idea', 'spi', 'spi', 'famili', 'power', 'dynast', 'polit', 'spread', 'pleas', 'psi', 'lick', 'us', 'see', 'peopl', 'agre', 'jkwi', 'idea']",idea idea spi spi famili power dynast polit spread pleas psi lick us see peopl agre jkwi idea
Mon Mar 25 23:06:35 +0000 2024,@DedynurPalakka @psi_id Terserah itu pandangan loe. Tp bg kami yg dulu memilih jkwi2x telah salah dan tertipu oleh wajah ndeso. Apa gunanya memilih jkw dulu utk mencegah pelanggar ham berkuasa kalo sekrg malah jkwi mendukung pelanggar ham itu ? Politik itu busuk penuh pengkhianatan.,@Dedynurpalakka @psi_id it's up to you.But we who used to choose JKWI2X were wrong and fooled by the face of Ndeso.What is the point of choosing JKW first to prevent human rights violators in power if the Sekrg even JKWI supports the human rights violators?Politics is rotten full of betrayal.,it s up to you But we who used to choose JKWIX were wrong and fooled by the face of Ndeso What is the point of choosing JKW first to prevent human rights violators in power if the Sekrg even JKWI supports the human rights violators Politics is rotten full of betrayal,it s up to you but we who used to choose jkwix were wrong and fooled by the face of ndeso what is the point of choosing jkw first to prevent human rights violators in power if the sekrg even jkwi supports the human rights violators politics is rotten full of betrayal,used choose jkwix wrong fooled face ndeso point choosing jkw first prevent human rights violators power sekrg even jkwi supports human rights violators politics rotten full betrayal,"['used', 'choose', 'jkwix', 'wrong', 'fooled', 'face', 'ndeso', 'point', 'choosing', 'jkw', 'first', 'prevent', 'human', 'rights', 'violators', 'power', 'sekrg', 'even', 'jkwi', 'supports', 'human', 'rights', 'violators', 'politics', 'rotten', 'full', 'betrayal']","['use', 'choos', 'jkwix', 'wrong', 'fool', 'face', 'ndeso', 'point', 'choos', 'jkw', 'first', 'prevent', 'human', 'right', 'violat', 'power', 'sekrg', 'even', 'jkwi', 'support', 'human', 'right', 'violat', 'polit', 'rotten', 'full', 'betray']",use choos jkwix wrong fool face ndeso point choos jkw first prevent human right violat power sekrg even jkwi support human right violat polit rotten full betray
Mon Mar 25 23:05:26 +0000 2024,sebutkan alasan jgn masuk fisip wahai oomfs fisip,"Mention the reasons for not entering FISIP, O Oomfs Fisip",Mention the reasons for not entering FISIP O Oomfs Fisip,mention the reasons for not entering fisip o oomfs fisip,mention reasons entering fisip oomfs fisip,"['mention', 'reasons', 'entering', 'fisip', 'oomfs', 'fisip']","['mention', 'reason', 'enter', 'fisip', 'oomf', 'fisip']",mention reason enter fisip oomf fisip
Mon Mar 25 23:05:22 +0000 2024,@DedynurPalakka @psi_id Nalar caleg psi tanpa nyali dan suara,@Dedynurpalakka @psi_id PSI Candidate Reason Without Guts and Sound,PSI Candidate Reason Without Guts and Sound,psi candidate reason without guts and sound,psi candidate reason without guts sound,"['psi', 'candidate', 'reason', 'without', 'guts', 'sound']","['psi', 'candid', 'reason', 'without', 'gut', 'sound']",psi candid reason without gut sound
Mon Mar 25 23:05:18 +0000 2024,Kesalahan PSI yang fatal adalah mengalihkan dukungan dan mengangkat ketum instan. Kedua hal ini mengongirmasi tidak punya branding yang kuat dan konsisten.,PSI's fatal error is to divert support and lift instant ketum.These two things confirm that they have no strong and consistent branding.,PSI s fatal error is to divert support and lift instant ketum These two things confirm that they have no strong and consistent branding,psi s fatal error is to divert support and lift instant ketum these two things confirm that they have no strong and consistent branding,psi fatal error divert support lift instant ketum two things confirm strong consistent branding,"['psi', 'fatal', 'error', 'divert', 'support', 'lift', 'instant', 'ketum', 'two', 'things', 'confirm', 'strong', 'consistent', 'branding']","['psi', 'fatal', 'error', 'divert', 'support', 'lift', 'instant', 'ketum', 'two', 'thing', 'confirm', 'strong', 'consist', 'brand']",psi fatal error divert support lift instant ketum two thing confirm strong consist brand
Mon Mar 25 23:00:55 +0000 2024,@jakfar87 @mulanbilqis Iya bener dan sekarang PSI bisa masuk senayan sebage tukang bersih2 wc diDPR,@jakfar87 @mulanbilqis yes right and now psi can enter senayan sebage cleaning wc didp,yes right and now psi can enter senayan sebage cleaning wc didp,yes right and now psi can enter senayan sebage cleaning wc didp,yes right psi enter senayan sebage cleaning wc didp,"['yes', 'right', 'psi', 'enter', 'senayan', 'sebage', 'cleaning', 'wc', 'didp']","['ye', 'right', 'psi', 'enter', 'senayan', 'sebag', 'clean', 'wc', 'didp']",ye right psi enter senayan sebag clean wc didp
Mon Mar 25 23:00:25 +0000 2024,@psi_id Partai spesialis banjir,@psi_id Flood Specialist Party,Flood Specialist Party,flood specialist party,flood specialist party,"['flood', 'specialist', 'party']","['flood', 'specialist', 'parti']",flood specialist parti
Mon Mar 25 23:00:11 +0000 2024,@msaid_didu @psi_id Ini sebagai akibat perawatan yg sudah baik tetapi tidak diteruskan selama 5 tahun salah sopo,@msaid_didu @psi_id as a result of good care but not continued for 5 years wrong sopo,as a result of good care but not continued for  years wrong sopo,as a result of good care but not continued for  years wrong sopo,result good care continued years wrong sopo,"['result', 'good', 'care', 'continued', 'years', 'wrong', 'sopo']","['result', 'good', 'care', 'continu', 'year', 'wrong', 'sopo']",result good care continu year wrong sopo
Mon Mar 25 22:59:52 +0000 2024,@aly_benzema @psi_id @grace_nat @Giring_Ganesha @Uki23 PSI AKU SANGAT MUAK!,@aly_benzema @psi_id @grace_nat @giring_ganesha @uki23 psi I'm very fed up!,psi I m very fed up,psi i m very fed up,psi fed,"['psi', 'fed']","['psi', 'fed']",psi fed
Mon Mar 25 22:58:32 +0000 2024,@mohsen_lbs @DedynurPalakka @jayusman92 @psi_id Dia nggak ngerasa tertipu karena mata hatinya sudah tertutup lidah jilatannya,@mohsen_lbs @dedynurpalakka @jayusman92 @psi_id he doesn't feel fooled because his heart has covered his tongue licking,he doesn t feel fooled because his heart has covered his tongue licking,he doesn t feel fooled because his heart has covered his tongue licking,feel fooled heart covered tongue licking,"['feel', 'fooled', 'heart', 'covered', 'tongue', 'licking']","['feel', 'fool', 'heart', 'cover', 'tongu', 'lick']",feel fool heart cover tongu lick
Mon Mar 25 22:56:31 +0000 2024,@zaharchivez aamiin Allahuma aamiin semoga keterima ya kak. tolong doa nya juga kak supaya saya keterima psikologi ugm jalur snbt,@zaharchivez aamiin Allahumma aamiin hopefully is accepted sis.Please pray too sis so that I accept the Psychology of UGM SNBT pathway,aamiin Allahumma aamiin hopefully is accepted sis Please pray too sis so that I accept the Psychology of UGM SNBT pathway,aamiin allahumma aamiin hopefully is accepted sis please pray too sis so that i accept the psychology of ugm snbt pathway,aamiin allahumma aamiin hopefully accepted sis please pray sis accept psychology ugm snbt pathway,"['aamiin', 'allahumma', 'aamiin', 'hopefully', 'accepted', 'sis', 'please', 'pray', 'sis', 'accept', 'psychology', 'ugm', 'snbt', 'pathway']","['aamiin', 'allahumma', 'aamiin', 'hope', 'accept', 'si', 'pleas', 'pray', 'si', 'accept', 'psycholog', 'ugm', 'snbt', 'pathway']",aamiin allahumma aamiin hope accept si pleas pray si accept psycholog ugm snbt pathway
Mon Mar 25 22:56:17 +0000 2024,@eastswitzher pagi camaba psi ui,@eastswitzher Morning Camaba Psi Ui,Morning Camaba Psi Ui,morning camaba psi ui,morning camaba psi ui,"['morning', 'camaba', 'psi', 'ui']","['morn', 'camaba', 'psi', 'ui']",morn camaba psi ui
Mon Mar 25 22:55:45 +0000 2024,@aly_benzema @psi_id @grace_nat @Giring_Ganesha @Uki23 Heru hanya merusak jakarta,@aly_benzema @psi_id @grace_nat @giring_ganesha @uki23 Heru only ruin Jakarta,Heru only ruin Jakarta,heru only ruin jakarta,heru ruin jakarta,"['heru', 'ruin', 'jakarta']","['heru', 'ruin', 'jakarta']",heru ruin jakarta
Mon Mar 25 22:53:15 +0000 2024,@mulanbilqis Padahal PSI kampanye gede2an bahkan lebih marak dari parte gerindra berdagang menggeber nama wiwi disetiap kampanye tp hasilnya gk jauh beda sama perolehan yg lama malahan yg sekarang ini manen cibiran disukur2in krn stagnan suaranya. Kapok gak lu,"@mulanbilqis even though the PSI campaign is big, even more widespread than the Gerindra parte trading, the name of Wiwi in every campaign but the results are not much different from the old acquisition.Kapok or not",even though the PSI campaign is big even more widespread than the Gerindra parte trading the name of Wiwi in every campaign but the results are not much different from the old acquisition Kapok or not,even though the psi campaign is big even more widespread than the gerindra parte trading the name of wiwi in every campaign but the results are not much different from the old acquisition kapok or not,even though psi campaign big even widespread gerindra parte trading name wiwi every campaign results much different old acquisition,"['even', 'though', 'psi', 'campaign', 'big', 'even', 'widespread', 'gerindra', 'parte', 'trading', 'name', 'wiwi', 'every', 'campaign', 'results', 'much', 'different', 'old', 'acquisition']","['even', 'though', 'psi', 'campaign', 'big', 'even', 'widespread', 'gerindra', 'part', 'trade', 'name', 'wiwi', 'everi', 'campaign', 'result', 'much', 'differ', 'old', 'acquisit']",even though psi campaign big even widespread gerindra part trade name wiwi everi campaign result much differ old acquisit
Mon Mar 25 22:50:29 +0000 2024,@keepitseigi @psi_id Tuntut secara hukum....!!,@keepepseigi @psi_id demanded legally .... !!,demanded legally,demanded legally,demanded legally,"['demanded', 'legally']","['demand', 'legal']",demand legal
Mon Mar 25 22:49:22 +0000 2024,psi psiricooooooooo,PSI PSIRICOOOOOOOOO,PSI PSIRICOOOOOOOOO,psi psiricooooooooo,psi psiricooooooooo,"['psi', 'psiricooooooooo']","['psi', 'psiricooooooooo']",psi psiricooooooooo
Mon Mar 25 22:47:45 +0000 2024,@seaoflukey AAAMIINNN SEMOGA BIRUUU ,@seaoflukey aaamiinnn Hopefully BLUEUU,aaamiinnn Hopefully BLUEUU,aaamiinnn hopefully blueuu,aaamiinnn hopefully blueuu,"['aaamiinnn', 'hopefully', 'blueuu']","['aaamiinnn', 'hope', 'blueuu']",aaamiinnn hope blueuu
Mon Mar 25 22:47:35 +0000 2024,@ch_chotimah2 @Candra4smara DASAR TIDAK TAU MALU.....@psi_id,@ch_chotimah2 @candra4smara basic is not shame ..... @psi_id,basic is not shame id,basic is not shame id,basic shame id,"['basic', 'shame', 'id']","['basic', 'shame', 'id']",basic shame id
Mon Mar 25 22:47:26 +0000 2024,@nobl3pure Pak Jokowi gagal bawa PSI masuk DPR ...,@nobl3pure Mr. Jokowi failed to bring PSI into the DPR ...,Mr Jokowi failed to bring PSI into the DP,mr jokowi failed to bring psi into the dp,mr jokowi failed bring psi dp,"['mr', 'jokowi', 'failed', 'bring', 'psi', 'dp']","['mr', 'jokowi', 'fail', 'bring', 'psi', 'dp']",mr jokowi fail bring psi dp
Mon Mar 25 22:46:43 +0000 2024,@aly_benzema @psi_id @grace_nat @Giring_Ganesha @Uki23 Ini di banjirin supaya meyakinkan bahwa DKI sdh tdk layak jadi ibukota.. faham kan...,@aly_benzema @psi_id @grace_nat @giring_ganesha @uki23 was flooded in order to ensure that dki was not worthy of being the capital ..,was flooded in order to ensure that dki was not worthy of being the capital,was flooded in order to ensure that dki was not worthy of being the capital,flooded order ensure dki worthy capital,"['flooded', 'order', 'ensure', 'dki', 'worthy', 'capital']","['flood', 'order', 'ensur', 'dki', 'worthi', 'capit']",flood order ensur dki worthi capit
Mon Mar 25 22:42:25 +0000 2024,Klaim itu bisa saja untuk narik konstituen. Seperti klaim pendukung 01 bahwa Anies didukung Malaikat Jibril. Anies disebut imam Mahdi. Itu namanya klaim. Yg terpenting secara struktural @jokowi ga ada dalam kepengurusan @psi_id. Secara organisasi @psi_id bukan partai @jokowi.,The claim could have been to withdraw the constituents.Like the claim of supporting 01 that Anies was supported by Angel Gabriel.Anies is called Imam Mahdi.That's a claim.The most important thing is structural @jokowi is not in the management of @psi_id.Organizational @psi_id is not the @jokowi party.,The claim could have been to withdraw the constituents Like the claim of supporting  that Anies was supported by Angel Gabriel Anies is called Imam Mahdi That s a claim The most important thing is structuralis not in the management of id Organizationalis not theparty,the claim could have been to withdraw the constituents like the claim of supporting  that anies was supported by angel gabriel anies is called imam mahdi that s a claim the most important thing is structuralis not in the management of id organizationalis not theparty,claim could withdraw constituents like claim supporting anies supported angel gabriel anies called imam mahdi claim important thing structuralis management id organizationalis theparty,"['claim', 'could', 'withdraw', 'constituents', 'like', 'claim', 'supporting', 'anies', 'supported', 'angel', 'gabriel', 'anies', 'called', 'imam', 'mahdi', 'claim', 'important', 'thing', 'structuralis', 'management', 'id', 'organizationalis', 'theparty']","['claim', 'could', 'withdraw', 'constitu', 'like', 'claim', 'support', 'ani', 'support', 'angel', 'gabriel', 'ani', 'call', 'imam', 'mahdi', 'claim', 'import', 'thing', 'structurali', 'manag', 'id', 'organizationali', 'theparti']",claim could withdraw constitu like claim support ani support angel gabriel ani call imam mahdi claim import thing structurali manag id organizationali theparti
Mon Mar 25 22:09:46 +0000 2024,@DedynurPalakka @KangManto123 @psi_id mati duluan bajingan tololnya,@Dedynurpalakka @kangmanto123 @psi_id dead first bastard,dead first bastard,dead first bastard,dead first bastard,"['dead', 'first', 'bastard']","['dead', 'first', 'bastard']",dead first bastard
Mon Mar 25 22:07:46 +0000 2024,@DedynurPalakka @mulanbilqis @psi_id bajingan tolol itu menciptakan pemimpin monyet partai sempak merah atas nama bajingan tidak laku partai sempak merah bersama bajingan tolol2 8 berarti bajingan tolol https://t.co/7jnJO27PdX,@Dedynurpalakka @mulanbilqis @psi_id stupid bastard created the leader of the red party monkey in the name of the bastard not selling red party with a stupid bastard 8 means stupid bastard https://t.co/7jnjo27pdx,stupid bastard created the leader of the red party monkey in the name of the bastard not selling red party with a stupid bastard  means stupid bastard https t co jnjopdx,stupid bastard created the leader of the red party monkey in the name of the bastard not selling red party with a stupid bastard  means stupid bastard https t co jnjopdx,stupid bastard created leader red party monkey name bastard selling red party stupid bastard means stupid bastard https co jnjopdx,"['stupid', 'bastard', 'created', 'leader', 'red', 'party', 'monkey', 'name', 'bastard', 'selling', 'red', 'party', 'stupid', 'bastard', 'means', 'stupid', 'bastard', 'https', 'co', 'jnjopdx']","['stupid', 'bastard', 'creat', 'leader', 'red', 'parti', 'monkey', 'name', 'bastard', 'sell', 'red', 'parti', 'stupid', 'bastard', 'mean', 'stupid', 'bastard', 'http', 'co', 'jnjopdx']",stupid bastard creat leader red parti monkey name bastard sell red parti stupid bastard mean stupid bastard http co jnjopdx
Mon Mar 25 22:05:08 +0000 2024,@aly_benzema @psi_id @grace_nat @Giring_Ganesha @Uki23 Tugas sudah selesai partai udah KO yang dijelekin malah moncer kalo di jepang udah pada harakiri kalo mereka cukup cengar cengir nahan muka malu.,@aly_benzema @psi_id @grace_nat @giring_ganesha @uki23 The task has been completed by the party that is already tilted instead it is monger if in Japan it is already on the harakiri if they are quite grinned with a shame.,The task has been completed by the party that is already tilted instead it is monger if in Japan it is already on the harakiri if they are quite grinned with a shame,the task has been completed by the party that is already tilted instead it is monger if in japan it is already on the harakiri if they are quite grinned with a shame,task completed party already tilted instead monger japan already harakiri quite grinned shame,"['task', 'completed', 'party', 'already', 'tilted', 'instead', 'monger', 'japan', 'already', 'harakiri', 'quite', 'grinned', 'shame']","['task', 'complet', 'parti', 'alreadi', 'tilt', 'instead', 'monger', 'japan', 'alreadi', 'harakiri', 'quit', 'grin', 'shame']",task complet parti alreadi tilt instead monger japan alreadi harakiri quit grin shame
Mon Mar 25 22:04:22 +0000 2024,@rudysirwi @WGreborn Untuk PSI beda itu emang partai punya Wiwi dia andil besar dari awal pendiriannya.,@rudysirwi @wgreborn for a different PSI that the party has Wiwi he has a big hand from the beginning of his establishment.,for a different PSI that the party has Wiwi he has a big hand from the beginning of his establishment,for a different psi that the party has wiwi he has a big hand from the beginning of his establishment,different psi party wiwi big hand beginning establishment,"['different', 'psi', 'party', 'wiwi', 'big', 'hand', 'beginning', 'establishment']","['differ', 'psi', 'parti', 'wiwi', 'big', 'hand', 'begin', 'establish']",differ psi parti wiwi big hand begin establish
Mon Mar 25 22:03:44 +0000 2024,@strike_bravo_b Sus tuh keknya lagian gelora aja dikasih masa PSI gak,"@strike_bravo_b sus, it's just a pira",sus it s just a pira,sus it s just a pira,sus pira,"['sus', 'pira']","['su', 'pira']",su pira
